{"corrected_text":"At 11:55 p.m., Mara leant against the wheelhouse door. Nessa's red backpack was on the deck beside her, and Councillor Hugh Saye watched it as if it might move. The grey case remained shut.\n\n\"Tom's still upstairs,\" Nessa said.\n\nMara checked Eli's compass; its needle had turned, but the reason was unclear. She wrote the time in the log as 11:55 p.m. and underlined it twice. Outside, the estuary was grey.","issues":[{"original":"11:55 pm","replacement":"11:55 p.m.","rule":"Use the specified narrative time style."},{"original":"wheel house","replacement":"wheelhouse","rule":"Use the specified vessel term."},{"original":"backpack were","replacement":"backpack was","rule":"Singular subject requires singular verb agreement."},{"original":"Hugh Say","replacement":"Hugh Saye","rule":"Correct the character spelling."},{"original":"Toms still","replacement":"Tom's still","rule":"Add the apostrophe for the contraction."},{"original":"reason were","replacement":"reason was","rule":"Singular subject requires singular verb agreement."},{"original":"11.55 p.m","replacement":"11:55 p.m.","rule":"Use the specified narrative time style, including the colon and final full stop."},{"original":"gray","replacement":"grey","rule":"Use Australian English spelling."}],"source_sha256":"","corrected_sha256":"","scope":"mechanical-only"}
